{
  "$schema": "https://json-schema.org/draft/2020-12/schema",
  "title": "Agent-MD illustrative replay evidence bundle",
  "type": "object",
  "required": ["case_id", "compact_summary", "files", "instructions", "title"],
  "properties": {
    "case_id": {"type": "string", "minLength": 1},
    "compact_summary": {"type": "string", "minLength": 1},
    "files": {
      "type": "array",
      "items": {
        "type": "object",
        "required": ["description", "evidence_path", "sha256", "source_path"],
        "properties": {
          "description": {"type": "string"},
          "evidence_path": {"type": "string"},
          "sha256": {"type": "string", "pattern": "^[a-f0-9]{64}$"},
          "source_path": {"type": "string"}
        },
        "additionalProperties": true
      }
    },
    "instructions": {"type": "string"},
    "title": {"type": "string"}
  },
  "additionalProperties": true
}
