{
  "case_id": "zero_gcmc_move_attempts",
  "compact_summary": "GCMC input and case config show exchange attempts are nonzero but translation and rotation attempts are zero.",
  "files": [
    {
      "description": "Case configuration with GCMC attempt counts.",
      "evidence_path": "evidence/case_gcmc_excerpt.yaml",
      "sha256": "e835d9795aee1cb5985a4035257a765f01e36354512686c90b23bed912b0d061",
      "source_path": "case.Mt_Na_LC050_N20.yaml"
    },
    {
      "description": "Generated LAMMPS input containing fix gcmc command.",
      "evidence_path": "evidence/lammps_input_gcmc_fix_excerpt.in",
      "sha256": "fb4ead65873f00064bebf2e97bf57786e03d69a917c924f907e9bdd35332dce3",
      "source_path": "examples/Mt_Na_LC050_N20/rh_0p90/in.gcmc_rh0p90_initial"
    },
    {
      "description": "Initial run diagnostics showing insert/delete acceptance fields.",
      "evidence_path": "evidence/run_initial_diagnostics.json",
      "sha256": "a70152aed5d4e8ef14e76678a594d7f15f06c0a5a8057fa1672bee2396d96420",
      "source_path": "examples/Mt_Na_LC050_N20/generated/Mt_Na_LC050_N20.rh0p90.run_initial_diagnostics.json"
    }
  ],
  "instructions": "Use only this evidence. Hidden ground truth is not included.",
  "title": "GCMC insertion/deletion only configuration"
}
