{
  "case_id": "stale_rh07_smoke_artifact",
  "compact_summary": "Existing RH0.7 archive/status appears complete, but later strict RH0.9 source changed and RH0.7 provenance may be stale.",
  "files": [
    {
      "description": "Historical campaign summary listing RH0.7 as complete.",
      "evidence_path": "evidence/campaign_summary_excerpt.csv",
      "sha256": "7c43c244ad70b86f3c64d16dbe3d4e205b368ac0a3ed801edaa9939662b2c680",
      "source_path": "generated/campaign_summary.csv"
    },
    {
      "description": "Strict reanalysis including RH0.7 failure row.",
      "evidence_path": "evidence/strict_reanalysis_excerpt.csv",
      "sha256": "3cea381b99e4b1a274b2fbb91803cc774903c24ae4d179b47eaf3e729d279ad6",
      "source_path": "generated/all_rh_final1m_fitted_change_reanalysis.csv"
    },
    {
      "description": "Existing archived RH0.7 summary.",
      "evidence_path": "evidence/rh0p70_archive_summary.json",
      "sha256": "edea3fb05e0ca36f912bd0c8975766e13d0ec7cf8b9b3267b94677ede2923946",
      "source_path": "examples/Mt_Na_LC050_N20/states/rh_0p70/summary.json"
    },
    {
      "description": "Updated strict RH0.9 archive summary.",
      "evidence_path": "evidence/rh0p90_strict_summary.json",
      "sha256": "3413ff051bdb259be7b5be274df1e20a3dc844f547a9153f76b3e61a5716f823",
      "source_path": "examples/Mt_Na_LC050_N20/states/rh_0p90_strict_pass/summary.json"
    },
    {
      "description": "Recorded source restart/provenance for RH0.7 start.",
      "evidence_path": "evidence/rh0p70_start_next_status.json",
      "sha256": "b2a5300754163293b330659d43a24688d6ac51beeed7cc530ccedc0034b88bf0",
      "source_path": "examples/Mt_Na_LC050_N20/rh_0p70/start_next_rh_status.json"
    }
  ],
  "instructions": "Use only this evidence. Hidden ground truth is not included.",
  "title": "Stale RH0.7 state after upstream RH0.9 changed"
}
